mail,name,status,first_name,last_name,role,telephone,photo,institution,type,lab,website,country,city,address,postal_code,biography,publications,members,system_role
anistal@crg.eu,anistal,0,Álvaro,Nistal,Partner,+34912345687,nistal.jpg,Center for Genomic Regulation (CRG),partner,Nistal Lab,http://nistal.example.org,UK,Barcelona,Dr. Aiguader 88,08003,"Alvaro Nistal is expert in adipiscing turpis placerat ut urna ut sed penatibus, porta integer tortor sociis! Sit pulvinar odio nunc. Nunc! Quis adipiscing mauris porttitor mid. Sit porta tortor lorem aliquam elit ac montes adipiscing, ac. Vel, arcu turpis lacus! Elementum pid tristique, dis nec amet, hac vut, porttitor lectus a non, auctor ridiculus rhoncus platea dictumst non aenean dictumst nisi, nisi cras vel, sociis eros! Nunc habitasse, placerat enim. Montes nascetur montes adipiscing ut dignissim, aliquet urna tincidunt adipiscing tincidunt, a adipiscing eu porta adipiscing integer vut? Amet et amet odio ultricies velit pid nunc. Pid massa facilisis tempor pid turpis sagittis eu.","<ul><li>Morbi in sem quis dui placerat ornare. Pellentesque odio nisi, euismod in, pharetra a, ultricies in, diam. Sed arcu. Cras consequat.</li><li>Praesent dapibus, neque id cursus faucibus, tortor neque egestas augue, eu vulputate magna eros eu erat. Aliquam erat volutpat. Nam dui mi, tincidunt quis, accumsan porttitor, facilisis luctus, metus.</li><li>Phasellus ultrices nulla quis nibh. Quisque a lectus. Donec consectetuer ligula vulputate sem tristique cursus. Nam nulla quam, gravida non, commodo a, sodales sit amet, nisi.</li><li>Pellentesque fermentum dolor. Aliquam quam lectus, facilisis auctor, ultrices ut, elementum vulputate, nunc.</li></ul>"
george.smith@cellartis.com,gsmith,0,George M.,Smith,Industry Leader,+445670678712,george.jpg,Cellartis,advisory,,http://cellartis.com,GB,,,,"Magna sed vel proin pulvinar tincidunt? Est tempor turpis! Magna mus tristique sociis vel natoque! Etiam ultrices magna non? Elit nisi nisi, cras turpis pulvinar porttitor ultrices mus. Mauris cum et integer risus a? Scelerisque? Enim! Sed, integer elementum, sagittis, eu? Etiam aliquam, ut sagittis, sit pid, lundium phasellus pulvinar scelerisque cum diam, rhoncus augue, integer et dis, velit scelerisque rhoncus porta natoque urna cursus? Rhoncus tortor dis vel? Vut. Dictumst nunc? Tortor porta vel ultricies ridiculus sit etiam. Platea augue montes, integer. Ridiculus parturient, aenean placerat vut pulvinar auctor, magna? In. Pellentesque porta, duis habitasse. Arcu magna! Penatibus."
rmiller@ucl.ac.uk,rmiller,0,Renee,Miller,PhD Student,,renee.jpg,University College London,researcher,Hayes Lab,http://hayes.example.org,GB,London,Station Road,N19 5UW,"Renee Miller is a PhD student at University College in London. Elementum tortor? Mattis et turpis ultrices eros amet sociis, tempor! Quis dolor. Mid ultricies, in sit facilisis ridiculus odio sit et vut dignissim et magna, aliquam nec, a aliquet platea? Tincidunt urna augue magnis facilisis rhoncus, mauris? Risus, rhoncus mauris, rhoncus platea! Mus et hac mus pellentesque nec amet pellentesque lacus, nisi mauris aliquam, integer, vel? Platea rhoncus ridiculus platea, habitasse urna mauris, nec. Turpis dictumst sagittis et dignissim a ac? In habitasse a tristique purus dictumst et pid. Adipiscing? A magna risus cras? Porta dignissim amet! Vel, quis adipiscing. Aliquet velit etiam lorem lundium, porta sed amet aenean velit."
ahayes@ucl.ac.uk,ahayes,0,Alexandria,Hayes,Project Coordinator,+447700954321,hayes.jpg,University College London,partner,Hayes Lab,http://hayes.example.org,GB,London,Station Road,N19 5UW,"Alexandria Hayes is professor of anthropology at University College in London. Elementum tortor? Mattis et turpis ultrices eros amet sociis, tempor! Quis dolor. Mid ultricies, in sit facilisis ridiculus odio sit et vut dignissim et magna, aliquam nec, a aliquet platea? Tincidunt urna augue magnis facilisis rhoncus, mauris? Risus, rhoncus mauris, rhoncus platea! Mus et hac mus pellentesque nec amet pellentesque lacus, nisi mauris aliquam, integer, vel? Platea rhoncus ridiculus platea, habitasse urna mauris, nec. Turpis dictumst sagittis et dignissim a ac? In habitasse a tristique purus dictumst et pid. Adipiscing? A magna risus cras? Porta dignissim amet! Vel, quis adipiscing. Aliquet velit etiam lorem lundium, porta sed amet aenean velit.","<ul><li>Morbi in sem quis dui placerat ornare. Pellentesque odio nisi, euismod in, pharetra a, ultricies in, diam. Sed arcu. Cras consequat.</li><li>Praesent dapibus, neque id cursus faucibus, tortor neque egestas augue, eu vulputate magna eros eu erat. Aliquam erat volutpat. Nam dui mi, tincidunt quis, accumsan porttitor, facilisis luctus, metus.</li><li>Phasellus ultrices nulla quis nibh. Quisque a lectus. Donec consectetuer ligula vulputate sem tristique cursus. Nam nulla quam, gravida non, commodo a, sodales sit amet, nisi.</li><li>Pellentesque fermentum dolor. Aliquam quam lectus, facilisis auctor, ultrices ut, elementum vulputate, nunc.</li></ul>",rmiller
editor@example.com,editor,1,Gordon,Freeman,Level 3 Research Associate,,gordon.jpg,Open Consortium,partner,Black Mesa Research Facility,http://www.bmrf.us/,US,Cambridge,77 Massachusetts Ave,MA 02139,,,,editor